Letter from the Committee to Free the SASO 9,,,,,,,,,,,1,,,,,,1,1,,,1,,,,,,,,,,,,,,,,,,,,1,,,,,,,,,,,,,,,,,1,,,,,,,,,,,,,,,,,,,,,,1,1,,,,,,,,,,,,,,,,,,,,,,,,,,,,,
Flyer advertising an event entitled Angola: From Liberation to Reconstruction,,,,,,,,,,,1,,,,,,1,1,,1,1,,,,,,,,,,,,,,,,,,,,1,,,,,,,,,,,,,,,,,,,,,,,,,,,,,,,,,,,,,,,,1,,1,,,,,,,,,,,,,,,,,,,,,,,,,,,
Flyer advertising Afrika Night & Dance benefit for a free Zimbabwe,,,,,,,,1,,,1,,,,,,1,1,,,1,,,,,,,,,,,,,,,,,,,,1,,,,,,,,,,,,,,,,,,,,,,,,,,,,,,,,,,,,,,,,,,1,,,,,,,,,,,,,,,1,1,,,,,,,,,,,
Flyer advertising a demonstration in solidarity with Zimbabwean liberation,,,,,,,,,,,1,,,,,,1,1,,,1,,,,,,,,,,,,,,,,,,,,1,,,,,,,,,,,,,,,,,,,,,,,,,,,,,,,,,,,,,,,,,,1,,,,,,,,,,,,,,,,,,,,,,,,,,,
Flyer for Southern Africa: The Struggle for National Liberation conference,,,,,,,,,,,1,,,,,,1,1,,,1,,,,,,,,,,,,,1,,,,,,,1,,,,,,,,,,,,,,,,,,,,,,,,,,,,,,,,,,,,,,,,,,1,,,,,,,,,,,,,,,,,,,,,,,,,,,
Letter requesting support for the Anti-Apartheid Day rally,,,,,,,,,,,1,,,,,,1,1,,,1,,,,,,,,,,,,,,,,,,,,1,,,,,,,,,,,,,,,,,,,,,,,,,,,,,,,,,,,,,,,,1,,,,,,,,,,,,,,,,,,,,,,,,,,,,,
Flyer announcing a night of solidarity with South African liberation,,,,,,,,,,,1,,,,,,1,1,,,1,,,,,,,,,,,,,,,,,,,,1,,,,,,,,,,,,,,,,,,,,,,,,,,1,,,,,,,,,,,,,,1,,,,,,,,,,,,,,,,,,,,,,,,,,,,,
Flyer advertising an event entitled Angola: From Liberation to Reconstruction,,,,,,,,,,,1,,,,,,1,1,,1,1,,,,,,,,,,,,,,,,,,,,1,,,,,,,,,,,,,,,,,,,,,,,,,,,,,,,,,,,,,,,,1,,1,,,,,,,,,,,,,,,,,,,,,,,,,,,
Flier for Prayer Pilgrimage for Freedom meeting at Enon Baptist Church,,,,,,,,,,,1,,1,,,,,,,,,,,,,,,,,,,,,,,1,1,,,,,,,,,,1,1,,,,,,,,,,,,,,,,,,,,,,,,,,,,,,,,,,,,1,,,,,,,,,,,,,,,,,,,,,,,,,,
Flier for the Black Community Survival Conference,,1,,,,,,,,,1,,,,,1,,1,,,,,,,,,,,,,,,,,,,,,,,,1,,1,,,,,,,,1,,,,,,,,,,,,,1,,,,,,,,,,,,,,,,,,,,,,,,,,,,,,,,,,,1,1,,,,,,,,,
Collection box of the Rhode Island Anti-Slavery Society owned by Garrison family,,,,,,,,,,,,,,,,,,,,,,,,,,,,,,,,,,,,,,,,,,1,,,,,,,,,,,,,,,,,,,,,,,,,,,,1,,,,,,,,,,,,,,,,,,,,,,,,,,,,,,,,1,1,,,,,,,
Placard calling for indictment of police officers used at Baltimore Protests,,,,1,1,,1,,1,1,1,,1,,,,,,,,,,,,,,,,,1,,,,1,,,,,,,,,,,,,,,,,,1,,,,,,,,,,,,,,,,,,,,,,,,,,,,,,,,,,,,,,,,,,,,1,1,,,,,,,,,,,,,
Poster for a Free Huey Rally at De Fremery Park,,,,1,,,,,,,1,,1,,,,1,1,,,,,,,,,,,,,,,,,,,,,,,,,,,,,,,,,,1,,,,,,,,,,,,,,1,,,,,,,,,,,,,,,,,,,,,,,,,,,,,,,,,,,,,,,,,,,,
Lift Every Voice For Victory,,1,,,,,,,,1,,,,,,,,,,,,,,,,,,,,,,,,,,,,,,,,,,,,,,,,,,,,,,,,,,,,,,,,,,,,,,,,,1,,,,,,,,,,,,,,,,,,,,,,,,,,,,,1,1,1,,,,
Missouri Democratic Ticket for the United States Presidential Election of 1868,,1,,,,,,,,,,,,,,,,,,,,,,,,,1,,1,,,,,,,,,1,1,,,,,,,,,,,1,,,,,,,,,,,,,,,,,,,,,,,1,,,,,,,,,,,,,,,,,1,,,,,,,,,,,,,,,,,,,,
Evidence of Intimidation & Fascist Crimes by USA: The War on the Black Panther Party 1968 - 1969,,1,,1,,1,,,,,1,1,1,,,,,,,,,,,,,,1,,,,,,,,,,,,,,,,,,,,,,,,,,,,,,,,,,,,1,,,1,,,,,,,,,,,,,,,,,,,,,,,,,,,,,,,,,,,,,,,,,,,,
Young Lords Party: Health Food Housing Education,,,1,,,,,,,,1,,,,,1,1,,,,,,,,,,1,,,,,,,1,,,,,,,,1,,1,,,,,,,,1,,,,,,,,,,,1,,,1,,,,,,,,,,,,,,,,,,,,,,,,,,,,,,,,,,,1,,,,,,1,1,,
The Negro People in the Struggle for Peace and Freedom,,1,,,,,,,,,,,1,,,,,,,,,,,,,,1,,,,,,,,,,,,,,,,,,,,,,,,,,,,,,,,,,,,,,,,,,,,,,,,1,,,,,,,,,,,,,,,,,,,,,,,,,,,,,,,,,,1,1,
They Shall Not Die!: Stop the Legal Lynching!: The Story of Scottsboro in Pictures,,1,,1,,,,,,,,,1,,,,,,,,,,,1,1,,,,,,,,,,,,,,,,,,,,,,,,,,,,,,,,,,,,,,,,,,,,,,,,,,1,,,,,,,,,,,,,,,,,,,,,,,,,,,,,,,,,,,
Old Jim Crow Has Got to Go!,,1,,,,,,,,,,,1,,,,,,,,,,,,1,,1,,,,,,1,,,,,,,,,,,,,,1,,,,,,,,,,,,,,,,,,,,,,,,,,,,1,,,,,,,,,,,,,,,,,,,,,,,,,,,,,,,,,,,
Radical Members of the South Carolina Legislature,,1,,,,,,,,1,,,,,,,,,,,,,,,,,1,,,,,,,,,,,,,,,,,,,,,,,,,,,,,,,,,,,,,,,,,,,,,,1,,,,,,,,,,,,,,,,,,,,,,,,,,,,,,,,,,,,,
Imperialism Destroys the People of Africa,,1,,,,,,,,,,,,,,,,,,,1,,,,,,1,,,,,,,,,,,,,,1,,,,,,,,,,,,,,,,,,,,,,,,,,,,,,,,,,1,,,,,,,,1,,,,,,,,1,,,,,1,,,,,,,,,,,,,,
Jim Crow in Uniform,,1,,,,,,,,,,,1,,,,,,,,,,,,,,,,,,,,,,,,,,,,,,,,,,,,,,,,,,,,,,,,,,,,,,,,,,,,,,1,,,,,,,,,,,,,,,,,,,,,,,,,,,,,,1,1,,,,
Press release for the Pan-Africanist Congress of Azania to the United Nations,,,,,,,,,,,,,,,,,1,1,,,1,,,,,,,,,,,,,,,,,,,,1,,,,,,,,,,,,,,,,,,,,,,,,,,,,,,,,,,1,,,,,,,,,,,,,,,,,,,,,,,,,,,,,,,,,,,
Notes from the United Nations on the Freedom Charter of South Africa,,,,,,,,,,,1,,,,,,1,1,,,1,,,,,,,,1,,,,,,,,,,,,1,,,,,,,,,,,,,,,,,,,,,,,,,,,,,,,,,,,,,,,,1,,1,,,,,,,,,,,,,,,,,,,,,,,,,,,
Radical Members of the South Carolina Legislature,,1,,,,,,,,1,,,,,,,,,,,,,,,,,1,,,,,,,,,,,,,,,,,,,,,,,,,,,,,,,,,,,,,,,,,,,,,,1,,,,,,,,,,,,,,,,,,,,,,,,,,,,,,,,,,,,,
Young Worker Vol 3 No 2,,1,,,,,,,,,,,,,,,1,,,,1,,,,,,1,,,,,,,,,,,,,,,,,,,,,,,,,,,,,,,,,,,,,,,,,,,,,,,,1,,,,1,,,,,,,,,,,,,,,,,,,,,,,,,,,,,,,
Young Worker Vol 3 No 1,,1,,1,,,,,,,1,,,,,,,,,,1,,,,,,1,,,1,,,,,,,,,,,,,,,,,,,,,,,,,,,,,,,,,,,,,,,,,,,,,1,,,,,,,,1,,,,,,,,,,,,,,,,,,,,,,,,,,,
International Pamphlets No 18: The American Negro,,1,,,,,,,,,,,,,,,,,,,,,1,,,,,,,,,,,,,,,,,,,,,,,,,,,,,,,,,,,,,,,,,,,,,,,,,,,,1,,,,,,,,,,,,,,,,,,,,,,,,,,,,,,,,,,,
The Cruel and Unusual Punishment of Henry Winston,,1,,1,,,,,,,,,1,,,,,,,,,,,,,,1,,,,,,,,,,,,,,,,,,,,,,,,,,,,,,,,,,,,,,,,,,,,,,,,1,,,,,,,,,,,,,,,,,,,,,,,,,,,,,,,,,,,

