TITLE,African diaspora,Politics,Group identity,Justice,Police brutality,Violence,Black Lives Matter,Dance,US History 2001,Race relations,Activism,US History 1961-1969,Civil rights,March on Washington for Jobs and Freedom,Holidays and festivals,Urban life,US History 1969-2001,Black power,Finance,Associations and institutions,International affairs,Suffrage,US History 1919-1933,Anti-Lynching Movement,Lynching,Women,Political organizations,Feminism,Law,Labor unions,Gender issues,US History Civil War 1861-1865,American South,Education,Mississippi Freedom Summer,Freedom,Religious groups,Discrimination,Race,United States History,Pan Africanism,Social reform,Men,Communities,Music,Photography,Segregation,US History 1953-1961,Economics,American West,Tulsa Race Massacre,Resistance,Emigration and immigration,Humanitarianism,Singers (Musicians),African American - Latinx Solidarity,Poor People's Campaign,Religion,Baseball,Sports,Jazz (Music),Hate crimes,Graphic arts,Art,Black Power (Black Pride),Design,Multilingual communication,Anti-slavery movements,Emancipation,Antislavery,Slavery,White supremacy movements,Reconstruction US History 1865-1877,Caricature and cartoons,Mass media,Black Nationalism,Transportation,Selma to Montgomery Marches,Vietnam War 1961-1975,Correspondence,Anti-apartheid movements,Motion pictures,Decolonization,Communication,Recreation,Latin jazz (Music),Instrumentalists (Musicians),Nuyorican Movement,Business,Advertising,Colonies,Portuguese colonialism,Government,Sexuality,LGBTQ,Children,Prisons,Afrobeat (Music),Calypso (Music),Poverty,Health,Abolitionist movement,Societies,US History 1933-1945,Military,World War 1939-1945,Young Lords Movement,Housing,US History 1945-1953,Technology
Pinback button of the Pan-African flag,1,1,,,,,,,,,,,,,,,,,,,,,,,,,,,,,,,,,,,,,,,,,,,,,,,,,,,,,,,,,,,,,,,,,,,,,,,,,,,,,,,,,,,,,,,,,,,,,,,,,,,,,,,,,,,,
Pinback button of the Pan-African flag,1,1,,,,,,,,,,,,,,,,,,,,,,,,,,,,,,,,,,,,,,,,,,,,,,,,,,,,,,,,,,,,,,,,,,,,,,,,,,,,,,,,,,,,,,,,,,,,,,,,,,,,,,,,,,,,
Pinback button which reads Malcolm X Speaks For Me,,1,1,,,,,,,,,,,,,,,,,,,,,,,,,,,,,,,,,,,,,,,,,,,,,,,,,,,,,,,,,,,,,,,,,,,,,,,,,,,,,,,,,,,,,,,,,,,,,,,,,,,,,,,,,,,
Pinback button for Clinton presidential campaign,,1,,,,,,,,,,,,,,,,,,,,,,,,,,,,,,,,,,,,,,,,,,,,,,,,,,,,,,,,,,,,,,,,,,,,,,,,,,,,,,,,,,,,,,,,,,,,,,,,,,,,,,,,,,,,
Pinback button promoting black unity,,1,,,,,,,,,,,,,,,,,,,,,,,,,,,,,,,,,,,,,,,,,,,,,,,,,,,,,,,,,,,,,,,,,,,,,,,,,,,,,,,,,,,,,,,,,,,,,,,,,,,,,,,,,,,,
Prop from dance recital performance Dance to Glory by Studio A,,1,,1,1,1,1,1,1,1,,,,,,,,,,,,,,,,,,,,,,,,,,,,,,,,,,,,,,,,,,,,,,,,,,,,,,,,,,,,,,,,,,,,,,,,,,,,,,,,,,,,,,,,,,,,,,,,,,,,
Pinback button from SNCC,,1,,,,,,,,,1,1,1,,,,,,,,,,,,,,,,,,,,,,,,,,,,,,,,,,,,,,,,,,,,,,,,,,,,,,,,,,,,,,,,,,,,,,,,,,,,,,,,,,,,,,,,,,,,,,,,,
Pinback button for Jesse Jackson’s 1988 presidential campaign,,1,,,,,,,,,,,,,,,,,,,,,,,,,,,,,,,,,,,,,,,,,,,,,,,,,,,,,,,,,,,,,,,,,,,,,,,,,,,,,,,,,,,,,,,,,,,,,,,,,,,,,,,,,,,,
Pinback button for the 1963 Freedom March,,1,,,,,,,,,1,1,1,1,,,,,,,,,,,,,,,,,,,,,,,,,,,,,,,,,,,,,,,,,,,,,,,,,,,,,,,,,,,,,,,,,,,,,,,,,,,,,,,,,,,,,,,,,,,,,,,,
Pinback button promoting Martin Luther King Day,,1,,,,,,,,,1,,,,1,,,,,,,,,,,,,,,,,,,,,,,,,,,,,,,,,,,,,,,,,,,,,,,,,,,,,,,,,,,,,,,,,,,,,,,,,,,,,,,,,,,,,,,,,,,,,,,
Bumper sticker for Mayor Washington,,1,,,,,,,,,,,,,,1,1,,,,,,,,,,,,,,,,,,,,,,,,,,,,,,,,,,,,,,,,,,,,,,,,,,,,,,,,,,,,,,,,,,,,,,,,,,,,,,,,,,,,,,,,,,,,,
Pinback button for SNCC's One Man One Vote campaign,,1,,,,,,,,,1,1,1,,,,,,,,,,,,,,,,,,,,,,,,,,,,,,,,,,,,,,,,,,,,,,,,,,,,,,,,,,,,,,,,,,,,,,,,,,,,,,,,,,,,,,,,,,,,,,,,,
Pinback button for CORE and Black Power,,1,,,,,,,,,1,1,1,,,,,1,,,,,,,,,,,,,,,,,,,,,,,,,,,,,,,,,,,,,,,,,,,,,,,,,,,,,,,,,,,,,,,,,,,,,,,,,,,,,,,,,,,,,,,,,,,,
Pinback button for Jesse Jackson’s 1984 presidential campaign,,1,,,,,,,,,,,,,,,,,,,,,,,,,,,,,,,,,,,,,,,,,,,,,,,,,,,,,,,,,,,,,,,,,,,,,,,,,,,,,,,,,,,,,,,,,,,,,,,,,,,,,,,,,,,,
Dues and finance report,,,,,,,,,,,,,,,,,,,1,1,,,,,,,,,,,,,,,,,,,,,,,,,,,,,,,,,,,,,,,,,,,,,,,,,,,,,,,,,,,,,,,,,,,,,,,,,,,,,,,,,,,,,,,,,,
Pinback button promoting black unity,,1,,,,,,,,,,,,,,,,,,,,,,,,,,,,,,,,,,,,,,,,,,,,,,,,,,,,,,,,,,,,,,,,,,,,,,,,,,,,,,,,,,,,,,,,,,,,,,,,,,,,,,,,,,,,
Pinback button promoting All-African People's Revolutionary Party,,1,,,,,,,,,,,,,,,,,,1,1,,,,,,,,,,,,,,,,,,,,,,,,,,,,,,,,,,,,,,,,,,,,,,,,,,,,,,,,,,,,,,,,,,,,,,,,,,,,,,,,,,,,,,,,,
Pinback button promoting All-African People's Revolutionary Party,1,1,,,,,,,,,,,,,,,,,,,1,,,,,,,,,,,,,,,,,,,,,,,,,,,,,,,,,,,,,,,,,,,,,,,,,,,,,,,,,,,,,,,,,,,,,,,,,,,,,,,,,,,,,,,,,
Bumper sticker with the slogan One Man One Vote,,1,,,,,,,,,,1,1,,,,,,,1,,1,,,,,,,,,,,,,,,,,,,,,,,,,,,,,,,,,,,,,,,,,,,,,,,,,,,,,,,,,,,,,,,,,,,,,,,,,,,,,,,,,,,,,,,,
Poster for the NAACP anti-lynching campaign,,,,,,1,,,,,1,,1,,,,,,,,,,1,1,1,,,,,,,,,,,,,,,,,,,,,,,,,,,,,,,,,,,,,,,,,,,,,,,,,,,,,,,,,,,,,,,,,,,,,,,,,,,,,,,,,,,,,
Pinback button for the Black National Political Convention,,1,,,,,,,,,1,,1,,,,1,,,,,,,,,,,,,,,,,,,,,,,,,,,,,,,,,,,,,,,,,,,,,,,,,,,,,,,,,,,,,,,,,,,,,,,,,,,,,,,,,,,,,,,,,,,,,
Poster for SCLC reading SCLC / Women Justice,,1,,1,,,,,,,1,,1,,,,1,,,,,,,,,1,1,,,,,,,,,,,,,,,,,,,,,,,,,,,,,,,,,,,,,,,,,,,,,,,,,,,,,,,,,,,,,,,,,,,,,,,,,,,,,,,,,,,
Pinback button featuring I Believe Anita Hill,,,,1,,,,,,,,,,,,,1,,,,,,,,,1,,1,1,1,1,,,,,,,,,,,,,,,,,,,,,,,,,,,,,,,,,,,,,,,,,,,,,,,,,,,,,,,,,,,,,,,,,,,,,,,,,,,,,,,
Pinback button featuring Abraham Lincoln and Frederick Douglass,,1,,,,,,,,1,,,,,,,,,,,,,,,,,,,,,,1,,,,,,,,,,,,,,,,,,,,,,,,,,,,,,,,,,,,,,,,,,,,,,,,,,,,,,,,,,,,,,,,,,,,,,,,,,,,,,
Leaflet for Mississippi Freedom Summer,,,,,,,,,,,1,1,1,,,,,,,,,1,,,,,,,,,,,1,1,1,1,,,,,,,,,,,,,,,,,,,,,,,,,,,,,,,,,,,,,,,,,,,,,,,,,,,,,,,,,,,,,,,,,,,,,,,,,,
Pinback button of Farrakhan quote,,1,,,,,,,,,,,,,,,,,,,,,,,,,,,,,,,,,,,1,,,,,,,,,,,,,,,,,,,,,,,,,,,,,,,,,,,,,,,,,,,,,,,,,,,,,,,,,,,,,,,,,,,,,,,,,
Placard from March on Washington WE DEMAND AN END TO POLICE BRUTALITY NOW,,,,1,,,,,,1,1,,1,,,,,,,,,,,,,,,,,,,,,,,,,1,1,1,,,,,,,,,,,,,,,,,,,,,,,,,,,,,,,,,,,,,,,,,,,,,,,,,,,,,,,,,,,,,,,,,,,,,,
Pinback button for a national holiday for Martin Luther King Jr,,,,,,,,,,,1,,1,,,,1,,,,,,,,,,,,,,,,,,,,,,,,,,,,,,,,,,,,,,,,,,,,,,,,,,,,,,,,,,,,,,,,,,,,,,,,,,,,,,,,,,,,,,,,,,,,,
Pinback button for the 1963 Freedom March,,1,,,,,,,,,1,1,1,1,,,,,,,,,,,,,,,,,,,,,,,,,,,,,,,,,,,,,,,,,,,,,,,,,,,,,,,,,,,,,,,,,,,,,,,,,,,,,,,,,,,,,,,,,,,,,,,,
Pinback button which reads Respect and Protect the Black Woman,,1,,,,,,,,,,,,,,,,,,,,,,,,1,,,,,,,,,,,,,,,,,,,,,,,,,,,,,,,,,,,,,,,,,,,,,,,,,,,,,,,,,,,,,,,,,,,,,,,,,,,,,,,,,,,,
Flyer urging people to tell Congress to end trade with South Africa,,,,,,,,,,,1,,,,,,1,1,,,1,,,,,,,,,,,,,,,,,,,,1,,,,,,,,,,,,,,,,,,,,,,,,,,,,,,,,,,,,,,,,,,,,,,,,,,,,,,,,,,,,,,,,,,,,,
Pinback button stating Black Lives Matter Everyday from MMM 20th Anniversary,,,,1,,1,1,,1,1,1,,1,,,,,,,,,,,,,,,,,,,,,,,,,,,,,1,1,,,,,,,,,,,,,,,,,,,,,,,,,,,,,,,,,,,,,,,,,,,,,,,,,,,,,,,,,,,,,,,,,,,
Flyer Advertising the Soul Together's Badass Black Festival,,,,,,,,,,,1,,,,1,,,,,,,,,,,,,,,,,,,,,,,,,,,,,1,1,,,,,,,,,,,,,,,,,,,,,,,,,,,,,,,,,,,,,,,,,,,,,,,,,,,,,,,,,,,,,,,,,
Pinback button for the Scottsboro United Front Defense,,,,1,,,,,,1,,,1,,,,,,,,,,,1,,,,,,1,,,,,,,,,,,,,,,,,,,,,,,,,,,,,,,,,,,,,,,,,,,,,,,,,,,,,,,,,,,,,,,,,,,,,,,,,,,,,,,,
Concerned Citizens Voters League Card from the home of HC Anderson,,1,,,,,,,,,,,,,,,,,,,,1,,,,,1,,,,,,1,,,,,,,,,,,1,,1,1,,,,,,,,,,,,,,,,,,,,,,,,,,,,,,,,,,,,,,,,,,,,,,,,,,,,,,,,,,,,,,,
Poster for a mass Memorial for Martin Luther King,,,,,,,,,,,1,,1,,,,,,,,,,,,,,1,,,,,,,,,,,,,,,,,,,,,,,,,,,,,,,,,,,,,,,,,,,,,,,,,,,,,,,,,,,,,,,,,,,,,,,,,,,,,,,,,,,
Mimeograph sheet with segregationist language,,,,,,,,,,,,,,,,,,,,,,,,,,,,,,,,,,1,,,,,,,,,,,,,1,1,,,,,,,,,,,,,,,,,,,,,,,,,,,,,,,,,,,,,,,,,,,,,,,,,,,,,,,,,,,,,,
Pinback button promoting reparations for the Tulsa Race Massacre,,,,1,,,,,,1,1,,,,,,,,,,,,,,,,,,,,,,1,,,,,,,1,,,,,,,,,1,1,1,,,,,,,,,,,,,,,,,,,,,,,,,,,,,,,,,,,,,,,,,,,,,,,,,,,,,,,,,,,
Pinback button for Robert F Kennedy’s 1968 presidential primary campaign,,1,,,,,,,,,,1,1,,,,,,,,,,,,,,,,,,,,,,,,,,,,,,,,,,,,,,,,,,,,,,,,,,,,,,,,,,,,,,,,,,,,,,,,,,,,,,,,,,,,,,,,,,,,,,,,,
Placard with STOP RACISM NOW message,,,,,,,,,,1,,1,1,,,,,,,1,,,,,,1,,,,,,,,,,,,,,,,,,,,,,,,,,1,,,,,,,,,,,,,,,,,,,,,,,,,,,,,,,,,,,,,,,,,,,,,,,,,,,,,,,,,,
Poster from Women's March on Washington with “We’re NOT going back”,,1,,,,,,,,,1,,,,,,,,,,,,,,,1,,1,,,,,,,,,,,,,,,,,,,,,,,,1,,,,,,,,,,,,,,,,,,,,,,,,,,,,,,,,,,,,,,,,,,,,,,,,,,,,,,,,,,
Poster from Women's March on Washington with “Refugees welcome”,,1,,,,,,,,,1,,,,,,,,,,1,,,,,1,,1,,,,,,,,,,,,,,,,,,,,,,,,1,1,1,,,,,,,,,,,,,,,,,,,,,,,,,,,,,,,,,,,,,,,,,,,,,,,,,,,,,,,,
Poster from Women's March on Washington reading Juntos se puede,,1,,,,,,,,,1,,,,,,,,,,,,,,,1,,1,,,,,,,,,,,,,,,,,,,,,,,,1,,,,,,,,,,,,,,,,,,,,,,,,,,,,,,,,,,,,,,,,,,,,,,,,,,,,,,,,,,
Sign from Women's March on Washington with “When you hurt me you hurt yourself,,1,,,,,,,,,1,,,,,,,,,,,,,,,1,,1,,,,,,,,,,,,,,,,,1,,,,,,,1,,,1,,,,,,,,,,,,,,,,,,,,,,,,,,,,,,,,,,,,,,,,,,,,,,,,,,,,,,,
Placard calling for reparations for the Tulsa Race Massacre,,,,1,,,,,,1,1,,,,,,,,,,,,,,,,,,,,,,1,,,,,,,1,,,,,,,,,1,1,1,,,,,,,,,,,,,,,,,,,,,,,,,,,,,,,,,,,,,,,,,,,,,,,,,,,,,,,,,,,
Sign for the Poor People’s Campaign Headquarters,,,,,,,,,,,1,1,1,,,,,,,,,,,,,,1,,,,,,,,,,,,,,,,,,,,,,,,,,,,,1,1,,,,,,,,,,,,,,,,,,,,,,,,,,,,,,,,,,,,,,,,,,,,,,,,,,,,,
Sign from Women's March on Washington with For such a time as this Esther 4:4,,1,,,,,,,,,1,,,,,,,,,,,,,,,1,,1,,,,,,,,,,,,,,,,,,,,,,,,1,,,,,,1,,,,,,,,,,,,,,,,,,,,,,,,,,,,,,,,,,,,,,,,,,,,,,,,,,,,
Sign about the integration of the Detroit Tigers,,1,,,,,,,,1,1,,1,,,,,,,,,,,,,,,,,,,,,,,,,,,,,,,,,,1,1,,,,,,,,,,,1,1,,,,,,,,,,,,,,,,,,,,,,,,,,,,,,,,,,,,,,,,,,,,,,,,,,
Prop from dance recital performance Dance to Glory by Studio A,,1,,1,1,1,1,1,1,1,,,,,,,,,,,,,,,,,,,,,,,,,,,,,,,,,,,,,,,,,,,,,,,,,,,,,,,,,,,,,,,,,,,,,,,,,,,,,,,,,,,,,,,,,,,,,,,,,,,,
Pinback button for Dizzy Gillespie,,1,,,,,,,,,,,,,,,,,,,,,,,,,,,,,,,,,,,,,,,,,,,,,,,,,,,,,,,,,,,1,,,,,,,,,,,,,,,,,,,,,,,,,,,,,,,,,,,,,,,,,,,,,,,,,
Placard for the 300 Men March,,,,1,1,1,1,,1,1,1,,,,,,,,,,,,,,,,,,,,,,,,,,,,,,,,1,1,,,,,,,,,,,,,,,,,,,,,,,,,,,,,,,,,,,,,,,,,,,,,,,,,,,,,,,,,,,,,,,,,,
Pinback button for NAACP Legal Defense Fund anti-lynching campaign,,1,,,,,,,,,,,,,,,,,,,,,,1,1,,,,1,,,,,,,,,,,,,,,,,,,,,,,,,,,,,,,,,1,,,,,,,,,,,,,,,,,,,,,,,,,,,,,,,,,,,,,,,,,,,,,,,,
Black Power,1,1,,1,,,,,,1,,1,,,,,,,,,1,,,,,,,,,,,,,,,,,,,,,,,,,,,,,,,1,,,,1,,,,,,,1,1,1,1,1,,,,,,,,,,,,,,,,,,,,,,,,,,,,,,,,,,,,,,,,,,,
Token with Am I Not a Woman and Sister,,,,,,,,,,,,,,,,,,,,,,,,,,1,,,,,,,,,,,,,,,,,,,,,,,,,,,,,,,,,,,,,,,,,,1,1,1,,,,,,,,,,,,,,,,,,,,,,,,,,,,,,,,,,,,,,,,
Placard calling for an end to police terror used at protests in Washington DC,,1,,1,1,,1,,1,,1,,,,,,,,,,,,,,,,,,,,,,,,,,,,,,,,,,,,,,,,,1,,,,,,,,,,,,,,,,,,,,,,,,,,,,,,,,,,,,,,,,,,,,,,,,,,,,,,,,,,
Placard reading community control of police now used at Baltimore protests,,,,1,1,,1,,1,1,1,,1,,,,,,,,,,,,,,,,,,,,,,,,,,,,,,,,,,,,,,,1,,,,,,,,,,,,,,,,,,,,,,,,,,,,,,,,,,,,,,,,,,,,,,,,,,,,,,,,,,
Pinback button reading Students for Mary Ellen,,,,1,,,,,1,,1,,,,,,,,,,,,,,,,,,,,,,,1,,,,,,,,,,,,,,,1,,,,,,,,,,,,,,,,,,,,,,1,,,,,,,,,,,,,,,,,,,,,,,,,,,,,,,,,,,,,,,
Civil Rights! Miscegenation Allowed by Congress Despite the Veto of the President,,1,,,,,,,,1,,,1,,,,,,,,,,,,,,,,1,,,,,,,,,1,1,,,,,,,,,,,,,,,,,,,,,,,,,,,,,,,,1,1,1,1,,,,,,,,,,,,,,,,,,,,,,,,,,,,,,,,,,,,
The Bakke Case and Education,,1,,,,,,,,,,,,,,,,,,,,,,,,,,,1,,,,,1,,,,,,,,,,,,,,,,,,,,,,,,,,,,,,,,,,,,,,,,,1,,,,,,,,,,,,,,,,,,,,,,,,,,,,,,,,,,,
Malcolm's Legacy,,1,,,,,,,,,,,,,,,,,,,,,,,,,1,,,,,,,,,,,,,,,,,,,,,,,,,,,,,,,,,,,,,,,,,,,,,,,,1,1,,,,,,,,,,,,,,,,,,,,,,,,,,,,,,,,,,
Pinback button for the 1963 March on Washington,,1,,,,,,,,,1,1,1,,,,,,,,,,,,,,,,,,,,,,,,,,,,,,,,,,,,,,,,,,,,,,,,,,,,,,,,,,,,,,,,,,,,,,,,,,,,,,,,,,,,,,,,,,,,,,,,,
Liberator broadside advertising a bus trip to the 1963 March on Washington,,,,,,,,,,,1,1,1,,,,,,,,,,,,,,,,,,,,,,,,,,,,,,,,,,,,,,,,,,,,,,,,,,,,,,,,,,,,,,,,1,,,,,,,,,,,,,,,,,,,,,,,,,,,,,,,,,
Ticket stub for Washington DC to Montgomery AL for Selma-Montgomery March,,,,,,,,,,,,1,1,,,,,,,,,,,,,,,,,,,,,,,,,,,,,,,,,,,,,,,,,,,,,,,,,,,,,,,,,,,,,,,,1,1,,,,,,,,,,,,,,,,,,,,,,,,,,,,,,,,
Flyer promoting the second phase of the NCNW's Citizenship Education Project,,1,,,,,,,,,1,,,,,,,,,,,1,,,,1,,,,,,,,1,,,,,,,,1,,,,,,,,,,,,,,,,,,,,,,,,,,,,,,,,,,,,,,,,,,,,,,,,,,,,,,,,,,,,,,,,,,,,
Pinback button promoting African Liberation Day,1,1,,,,,,,,,,,,,,,,,,1,,,,,,,,,,,,,,,,1,,,,,,,,,,,,,,,,,,,,,,,,,,,,,,,,,,,,,,,,,,,,,,,,,,,,,,,,,,,,,,,,,,,,,,,,,,
Pinback button promoting African Liberation Day,1,1,,,,,,,,,,,,,,,,,,1,,,,,,,,,,,,,,,,1,,,,,,,,,,,,,,,,,,,,,,,,,,,,,,,,,,,,,,,,,,,,,,,,,,,,,,,,,,,,,,,,,,,,,,,,,,
Flyer advertising student strike against the Vietnam War,,1,,,,,,,,,,,,,,,,,,,1,,,,,,,,,,,,,1,,,,,,,,,,,,,,,,,,1,,,,,,,,,,,,,,,,,,,,,,,,,,,1,,,,,,,,,,,,,,,,,,,,,,,,,,,,,,,
Flyer promoting the Citizenship Education Project,,1,,,,,,,,,1,,,,,,,,,,,1,,,,1,,,,,,,,1,,,,,,,,1,,,,,,,,,,,,,,,,,,,,,,,,,,,,,,,,,,,,,,,,,,,,,,,,,,,,,,,,,,,,,,,,,,,,
Letterhead of the Pan African Students Organization in the Americas Inc,,,,,,,,,,,1,1,,,,,1,1,,1,1,,,,,,,,,,,,,,,,,,,,1,,,,,,,1,,,,,,,,,,,,,,,,,,,,,,,,,,,,,,,,1,,,,,,,,,,,,,,,,,,,,,,,,,,,,,,
Letter by the Episcopal Churchmen for South Africa,,,,,,,,,,,,,,,,,1,1,,,1,,,,,,,,,,,,,,,,,,,,1,,,,,,,,,,,,,,,,,1,,,,,,,,,,,,,,,,,,,,,,1,,,,,,,,,,,,,,,,,,,,,,,,,,,,,,
Flyer announcing a speech by Dean GA FFrench-Beytagh,,,,,,,,,,,1,,,,,,1,1,,,1,,,,,,,,,,,,,,,,,,,,1,,,,,,,,,,,,,,,,,,,,,,,,,,,,,,,,,,,,,,,,,,,,,,,,,,,,,,,,,,,,,,,,,,,,,
Flyer announcing a protest against apartheid in South Africa,,,,,,,,,,,1,,,,,,1,1,,,1,,,,,,,,,,,,,,,,,,,,1,,,,,,,,,,,,,,,,,,,,,,,,,,,,,,,,,,,,,,,,1,,,,,,,,,,,,,,,,,,,,,,,,,,,,,
Black and white poster of Huey Newton and Bobby Seale,,,,1,,,,,,,,,1,,,,1,1,,,,,,,,,1,,,,,,,,,,,,,,,,,,,,,,,,,,,,,,,,,,,,,,,,,,,,,,,,,,,,,,,,,,,,,,,,,,,,,,,,,,,,,,,,,,,
Pinback button stating Justice Or Else 10-10-2015 from MMM 20th Anniversary,,,,1,,,1,,1,1,1,,1,,,,,,,,,,,,,,,,,,,,,,,,,,,,,1,1,,,,,,,,,,,,,,,,,,,,,,,,,,,,,,,,,,,,,,,,,,,,,,,,,,,,,,,,,,,,,,,,,,,
Letter discussing the activities of the Commitee to Free the SASO 9,,,,,,,,,,,1,,,,,,1,1,,,1,,,,,,,,,,,,,,,,,,,,1,,,,,,,,,,,,,,,,,,,,,,,,,,,,,,,,,,,,,,,1,,,,,,,,,,,,,,,,,,,,,,,,,,,,,,
Letter announcing meeting to oppose US intervention in Angola,,,,,,,,,,,1,,,,,,1,1,,,1,,,,,,,,,,,,,,,,,,,,1,,,,,,,,,,,,,,,,,,,,,,,,,,,,,,,,,,,,,,,1,,,,,,,,,,,,,,,,,,,,,,,,,,,,,,
Newspaper insert for Jesse Jackson 1984 presidential campaign,,1,,,,,,,,,,,,,,,,,,,,,,,,,,,,,,,,,,,,,,,,,,,,,,,,,,,,,,,,,,,,,,,,,,,,,,,,,,,,,,,,,,,,,,,,,,,,,,,,,,,,,,,,,,,,
Pinback button featuring a campaign portrait of Senator William B  Nash,,1,,,,,,,,,,,,,,,,,,,,,,,,,,,,,,,1,,,,,,,,,,,,,,,,,,,,,,,,,,,,,,,,,,,,1,,1,,1,,,,,,,,,,,,,,,,,,,,,,,,,,,,,,,,,,,,,
Letter from the Committee to Free the SASO 9,,,,,,,,,,,1,,,,,,1,1,,,1,,,,,,,,,,,,,,,,,,,,1,,,,,,,,,,,,,,,,,1,,,,,,,,,,,,,,,,,,,,,,1,1,,,,,,,,,,,,,,,,,,,,,,,,,,,,,
Flyer advertising film viewings for Katatura and Namibia- A Trust Betrayed,,,,,,,,,,,1,,,,,,1,1,,,1,,,,,,,,,,,,,,,,,,,,1,,,,,,,,,,,,,,,,,,,,,,,,,,,,,,,,,,,,,,,,,1,1,,,,,,,,,,,,,,,,,,,,,,,,,,,
Flyer advertising demonstration in support of liberating Southern Africa,,,,,,,,,,,1,,,,,,1,1,,,1,,,,,,,,,,,,,,,,,,,,1,,,,,,,,,,,,,,,,,,,,,,,,,,,,,,,,,,,,,,,,,,1,,,,,,,,,,,,,,,,,,,,,,,,,,,
Placard reading Sanction South Africa Now!,,1,,,,,,,,,1,,,,,,1,,,,1,,,,,,,,,,,,,,,,,,,,,,,,,,,,,,,,,,,,,,,,,,,,,,,,,,,,,,,,,,,,,,,1,,,,,,,,,,,,,,,,,,,,,,,,,,
Flyer announcing free the Saso 9 protest,,,,,,,,,,,1,,,,,,1,1,,,1,,,,,,,,,,,,,,,,,,,,1,,,,,,,,,,,,,,,,,,,,,,,,,,,,,,,,,,,,,,,,1,,1,,,,,,,,,,,,,,,,,,,,,,,,,,,
Flyer announcing the commemoration of the 19th anniversary of the MPLA,,,,,,,,,,,,,,,,,1,1,,,1,,,,,,,,,,,,,,,,,,,,1,,,,,,,,,,,,,,,,,,,,,,,,,,,,,,,,,,,,,,,,,,1,,,,,,,,,,,,,,,,,,,,,,,,,,,
Letter by the Episcopal Churchmen for South Africa,,,,,,,,,,,1,,,,,,1,1,,,1,,,,,,,,,,,,,,,,,,,,1,,,,,,,,,,,,,,,,,1,,,,,,,,,,,,,,,,,,,,,,1,,,,,,,,,,,,,,,,,,,,,,,,,,,,,,
Flyer advertising a fundraising event for Zimbabwean refugees,,,,,,,,,,,1,,,,,,1,1,,,1,,,,,,,,,,,,,,,,,,,,1,,,,,,,,,,,,,,,,,,,,,,,,,,,,,,,,,,,,,,,,,,,,1,,,,,,,,,,,,,,,,,,,,,,,,,
Flyer advertising an evening of jazz at NYU Loeb Student Center,,,,,,,,,,,,,,,,,,,,,,,,,,,,,,,,,,,,,,,,,,,,,,,,,,,,,,,,,,,,,1,,,,,,,,,,,,,,,,,,,,,,,,,1,1,1,,,,,,,,,,,,,,,,,,,,,,
Placard stating Black Lives Matter used at Million Man March 20th Anniversary,,,,1,,,1,,1,1,1,,1,,,,,,,,,,,,,,,,,,,,,,,,,,,,,1,1,,,,,,,,,,,,,,,,,,,,,,,,,,,,,,,,,,,,,,,,,,,,,,,,,,,,,,,,,,,,,,,,,,,
Flyer advertising a protest against the sale of the Krugerrand,,,,,,,,,,,1,,,,,,1,1,,,1,,,,,,,,,,,,,,,,,,,,1,,,,,,,,,,,,,,,,,,,,,,,,,,1,,,,,,,,,,,,,,1,,,,,,,,1,,,,,,,,,,,,,,,,,,,,,
Flyer Advertising an African Dance and Show,1,,,,,,,1,,,1,,,,,,,,,,,,,,,,,,,,,,,1,,,,,,,,,,1,1,,,,,,,,,,,,,,,,,,,,,,,,,,,,,,,,,,,,,,,,,,,,,,,,,,,,,,,,,,,,,,,,,
Flyer advertising Astracarnaval,1,,,,,,,1,,,,,,,1,,,,,,,,,,,,,,,,,,,,,,,,,,,,,1,1,,,,,,,,,,,,,,,,,,,,,,,,,,,,,,,,,,,,,,,,,,,,,,,,,,,,,,,,,,,,,,,,,
Flyer advertising Women and the African Revolution program,1,,,,,,,,,,1,,,,,,,1,,,1,,,,,1,,,,,,,,,,,,,,,1,,,,,,,,,,,,,,,,,,,,,,,,,,,,,,,,,,,,,,,,,,,,,,,,,,,,,,,,,,,,,,,,,,,,,
Flyer advertising the September 1977 issue of The People's Herald,,,,,,,,,,,1,,,,,,1,1,,,1,,,,,,,,,,,,,,,,,,,,1,,,,,,,,,,,,,,,,,,,,,,,,,,,,,,,,,,1,,,,,,,,1,,,,,,,1,,,,,,,,,,,,,,,,,,,,
Pinback button supporting the Scottsboro Boys,,,,1,,,,,,,,,,,,,,,,,,,1,1,,,,,1,,,,,,,,,1,1,,,,,,,,,,,,,,,,,,,,,,,,,,,,,,,,,,,,,,,,,,,,,,,,,,,,,,,,,,,,,,,,,,,,,,,
Flyer for demonstration against Portuguese imperialism in Africa,,,,,,,,,,,1,,,,,,1,1,,,1,,,,,,,,,,,,,,,,,,,,1,,,,,,,,,,,,,,,,,,,,,,,,,,,,,,,,,,,,,,,,,,,,,,,,,,1,1,,,,,,,,,,,,,,,,,,
Flyer advertising a protest against slaughter in Rhodesia,,,,,,,,,,,1,,,,,,1,1,,,1,,,,,,,,,,,,,,,,,,,,1,,,,,,,,,,,,,,,,,,,,,,,,,,,,,,,,,,,,,,,,,,,,,,,,,,,,,,,,,,,,,,,,,,,,,
Flyer advertising a talk by Tapson Mawere,,,,,,,,,,,1,,,,,,1,1,,,1,,,,,,,,,,,,,,,,,,,,1,,,,,,,,,,,,,,,,,,,,,,,,,,,,,,,,,,,,,,,,,,1,,,,,,,,,,,,,,,,,,,,,,,,,,,
Flyer advertising Spartacist League Forum,,,,,,,,,,,1,,,,,,1,1,,,1,,,,,,,,,,,,,,,,,,,,1,,,,,,,,,,,,,,,,,,,,,,,,,,,,,,,,,,,,,,,,,,,,,,,,,,,,,,,,,,,,,,,,,,,,,
Letter from the African National Council-Zimbabwe,,,,,,,,,,,1,,,,,,1,1,,,1,,,,,,,,,,,,,,,,,,,,1,,,,,,,,,,,,,,,,,,,,,,,,,,,,,,,,,,,,,,,1,1,,1,,,,,,,,,,,,,,,,,,,,,,,,,,,
Flyer announcing a campaign to support Namibia,,,,,,,,,,,1,,,,,,1,1,,,1,,,,,,,,,1,,,,,,,,,,,1,,,,,,,,,,,,,,,,,,,,,,,,,,,,,,,,,,,,,,,,,,1,,,,,,,,,,,,,,,,,,,,,,,,,,,
Flyer about the Namibia Three and International Women's Day 1976,,,,,,,,,,,1,,,,,,1,1,,,1,,,,,1,,,,,,,,,,,,,,,1,,,,,,,,,,,,,,,,,,,,,,,,,,,,,,,,,,,,,,,,,,1,,,,,,,,,,,,,,,,,,,,,,,,,,,
Flyer Promoting a Rally for Angela Davis Day,,,,1,,,,,,,1,,,,,,,1,,,,,,,,1,,,,,,,,,,,,,,,,,,,,,,,,,,,,,,,,,,,,,,,,,,,,,,,,,,,,,,,,,,,,,,,,,,,,,,,,,,,,,,,,,,,,
Pinback button for Kennedy - Johnson 1960 presidential campaign,,1,,,,,,,,,,,1,,,,,,,,,,,,,,,,,,,,,,,,,,,,,,,,,,,1,,,,,,,,,,,,,,,,,,,,,,,,,,,,,,,,,,,,,,,,,,,,,,,,,,,,,,,,,,,,,,
Poster for presidential candidate Shirley Chisholm,,1,,,,,,,,,,,,,,,1,,,,,,,,,1,,,,,,,,,,,,,,,,1,,,,,,,,,,,,,,,,,,,,,,,,,,,,,,,,,,,,,,,,,,,,,,,,,,,,,,,,,,,,,,,,,,,,
Pinback button with I Believe Anita Hill,,1,,1,,,,,,,1,,,,,,1,,,,,,,,,1,,1,1,,1,,,,,,,,,,,,,,,,,,,,,,,,,,,,,,,,,,,,,,,,,,,,,,,,,,,,,,,,,,,,,,1,1,,,,,,,,,,,,,,,,
Flier with segregationist voting guide,,,,,,,,,,,,,,,,,,,,,,,,,,,,,,,,,,1,,,,,,,,,,,,,1,1,,,,,,,,,,,,,,,,,,,,,,,,1,,,,,,,,,,,,,,,,,,,,,,,,,,,,,,,,,,,,,,
Organization of Afro-American Unity Inc Aims and Objectives,,1,,,,,,,,,,1,,,,,,,,,,,,,,,,,,,,,,,,,,,,,1,,,,,,,,,,,,,,,,,,,,,,,,,,,,,,,,,,,1,,,,,,,,,,,,,,,,,,,,,,,,,,,,,,,,,,
Folding tab button for Kennedy - Johnson 1960 presidential campaign,,1,,,,,,,,,,,1,,,,,,,,,,,,,,,,,,,,,,,,,,,,,,,,,,,1,,,,,,,,,,,,,,,,,,,,,,,,,,,,,,,,,,,,,,,,,,,,,,,,,,,,,,,,,,,,,,
Placard stating I AM A MAN carried by Arthur J Schmidt in 1968 Memphis March,,,,,,,,,,1,1,1,1,,,,,,,,,,,,,,,,,1,,,,,,,,,,,,,,,,,,,,,,,,,,,,,,,,,,,,,,,,,,,,,,,,,,,,,,,,,,,,,,,,,,,,,,,,,,,,,,,,
Sign from Women's March on Washington with I Stand with,,1,1,,,,,,,,1,,,,,,,,,,,,,,,1,,1,,,,,,,,,,,,,,,,,,,,,,,,1,1,,,,,,,,,,,,,,,,,,,,,,,,,,,,,,,,,,,,,,,,,1,1,,,,,,,,,,,,,,,
Political card antagonizing candidates favoring integration,,,,,,,,,,,,,,,,,,,,,,,,,,,,,,,,,,1,,,,,,,,,,,,,1,1,,,,,,,,,,,,,,,,,,,,,,,,,,,,,,,,,,,,,,,,,,,,,,,,,,,,,,,,,,,,,,
Pennant from The March on Washington for Jobs and Freedom,,1,,,,,,,,,1,1,1,1,,,,,,,,,,,,,,,,,,,,,,1,,,,,,,,,,,,,,,,,,,,,,,,,,,,,,,,,,,,,,,,,,,,,,,,,,,,,,,,,,,,,,,,,,,,,,,,,,
Placard stating HONOR KING: END RACISM carried in 1968 Memphis March,,,,,,,,,,1,1,1,1,,,,,,,,,,,,,,,,,,,,,,,,,,,,,,,,,,,,,,,,,,,,,,,,,,,,,,,,,,,,,,,,,,,,,,,,,,,,,,,,,,,,,,,,,,,,,,,,,
Prop from dance recital performance Dance to Glory by Studio A,,1,,1,1,1,1,1,1,1,,,,,,,,,,,,,,,,,,,,,,,,,,,,,,,,,,,,,,,,,,,,,,,,,,,,,,,,,,,,,,,,,,,,,,,,,,,,,,,,,,,,,,,,,,,,,,,,,,,,
Placard reading Stop racism now used at Baltimore protests,,,,1,1,,1,,1,1,1,,1,,,,,,,,,,,,,,,,,,,,,,,,,,,,,,,,,,,,,,,1,,,,,,,,,,,,,,,,,,,,,,,,,,,,,,,,,,,,,,,,,,,,,,,,,,,,,,,,,,
Placard with Stop the War on Black America used at protests in Washington DC,,1,,1,1,,1,,1,,1,,,,,,,,,,,,,,,,,,,,,,,,,,,,,,,,,,,,,,,,,1,,,,,,,,,,,,,,,,,,,,,,,,,,,,,,,,,,,,,,,,,,,,,,,,,,,,,,,,,,
Prop from dance recital performance Dance to Glory by Studio A,,1,,1,1,1,1,1,1,1,,,,,,,,,,,,,,,,,,,,,,,,,,,,,,,,,,,,,,,,,,,,,,,,,,,,,,,,,,,,,,,,,,,,,,,,,,,,,,,,,,,,,,,,,,,,,,,,,,,,
Prop from dance recital performance Dance to Glory by Studio A,,1,,1,1,1,1,1,1,1,,,,,,,,,,,,,,,,,,,,,,,,,,,,,,,,,,,,,,,,,,,,,,,,,,,,,,,,,,,,,,,,,,,,,,,,,,,,,,,,,,,,,,,,,,,,,,,,,,,,
Pennant from the March on Washington carried by Edith Lee-Payne,,,,,,,,,,,1,1,1,,,,,,,,,,,,,,,,,1,,,,,,1,,,,,,,,,,,,,,,,,,,,,,,,,,,,,,,,,,,,,,,,,,,,,,,,,,,,,,,,,,,,1,,,,,,,,,,,,,,
Prop from dance recital performance Dance to Glory by Studio A,,1,,1,1,1,1,1,1,1,,,,,,,,,,,,,,,,,,,,,,,,,,,,,,,,,,,,,,,,,,,,,,,,,,,,,,,,,,,,,,,,,,,,,,,,,,,,,,,,,,,,,,,,,,,,,,,,,,,,
Prop from dance recital performance Dance to Glory by Studio A,,1,,1,1,1,1,1,1,1,,,,,,,,,,,,,,,,,,,,,,,,,,,,,,,,,,,,,,,,,,,,,,,,,,,,,,,,,,,,,,,,,,,,,,,,,,,,,,,,,,,,,,,,,,,,,,,,,,,,
Prop from dance recital performance Dance to Glory by Studio A,,1,,1,1,1,1,1,1,1,,,,,,,,,,,,,,,,,,,,,,,,,,,,,,,,,,,,,,,,,,,,,,,,,,,,,,,,,,,,,,,,,,,,,,,,,,,,,,,,,,,,,,,,,,,,,,,,,,,,
Prop from dance recital performance Dance to Glory by Studio A,,1,,1,1,1,1,1,1,1,,,,,,,,,,,,,,,,,,,,,,,,,,,,,,,,,,,,,,,,,,,,,,,,,,,,,,,,,,,,,,,,,,,,,,,,,,,,,,,,,,,,,,,,,,,,,,,,,,,,
Poster reading Jail Darren Wilson 4 Murder used at Baltimore protests,,1,,1,1,1,1,,1,1,1,,1,,,,,,,,,,,,,,,,,,,,,,,,,,,,,,,,,,,,,,,1,,,,,,,,,,,,,,,,,,,,,,,,,,,,,,,,,,,,,,,,,,,,,,,,,,,,,,,,,,
Prop from dance recital performance Dance to Glory by Studio A,,1,,1,1,1,1,1,1,1,,,,,,,,,,,,,,,,,,,,,,,,,,,,,,,,,,,,,,,,,,,,,,,,,,,,,,,,,,,,,,,,,,,,,,,,,,,,,,,,,,,,,,,,,,,,,,,,,,,,
Poster reading Race is not a crime used at Baltimore protests,,,,1,1,,1,,1,1,1,,1,,,,,,,,,,,,,,,,,,,,,,,,,,,,,,,,,,,,,,,1,,,,,,,,,,,,,,,,,,,,,,,,,,,,,,,,,,,,,,,,,,,,,,,,,,,,,,,,,,
Poster reading All night all day we will fight for freddie gray,,,,1,1,,1,,1,1,1,,1,,,,,,,,,,,,,,,,,,,,,,,,,,,,,,,,,,,,,,,1,,,,,,,,,,,,,,,,,,,,,,,,,,,,,,,,,,,,,,,,,,,,,,,,,,,,,,,,,,
Prop from dance recital performance Dance to Glory by Studio A,,1,,1,1,1,1,1,1,1,,,,,,,,,,,,,,,,,,,,,,,,,,,,,,,,,,,,,,,,,,,,,,,,,,,,,,,,,,,,,,,,,,,,,,,,,,,,,,,,,,,,,,,,,,,,,,,,,,,,
Placard reading JUSTICE 4 FREDDIE GREY used at Baltimore Protests,,,,1,1,,1,,1,1,1,,1,,,,,,,,,,,,,,,,,,,,,,,,,,,,,,,,,,,,,,,1,,,,,,,,,,,,,,,,,,,,,,,,,,,,,,,,,,,,,,,,,,,,,,,,,,,,,,,,,,
The Proposed Amendment to the Constitution,,1,,,,,,,,,,,,,,,,,,,,1,,,,,,,,,,,,,,,,1,1,,,,,,,,,,,,,,,,,,,,,,,,,,,,,,,,,,1,,,,,,,,,,,,,,,,,,,,,,,,,,,,,,,,,,,,,
Black Liberation - Cultural and Revolutionary Nationalism,,1,,,,,,,,,,,1,,,,,,,,,,,,,,1,,,,,,,,,,,,,,,,,,,,,,,,,,,,,,,,,,,,,,1,,,,,,,,,,1,,,,,,,,,,,,,,,,,,,,,,,,,,,,,,,,,,,
Program from the March on Washington,,1,,,,,,,,1,1,1,1,,,,,,,,,,,,,,,,,1,,,,,,,,,,,,,,,,,1,,,,,,,,,,,,,,,,,,,,,,,,,,,,,,,,,,,,,,,,,,,,,,,,,,,,,,,,,,,,,,,
March on Washington for Jobs and Freedom: Organizing Manual No 2,,1,,,,,,,,,1,1,1,1,,,,,,,,,,,,,1,,,,,,,,,,,,,,,,,,,,,,,,,,,,,,,,,,,,,,,,,,,,,,,,,,,,,,,,,,,,,,,,,,,,,,,,,,,,,,,,,,,
Pamphlet about the Patrice Lumumba Coalition,,,,,,,,,,,1,,,,,,,1,,,1,,,,,,1,,,,,,,,,,,,,,1,,,,,,,,,,,,,,,,,,,,,,,,,,,,,,,,,,,,,,,,1,,,,,,,,,,,,,,,,,,,,,,,,,,,,,
Flyer Advertising an Evening with Angela Davis,,1,,,,,,,,,1,,,,,,1,1,,,,,,,,,,,,,,,,,,,,,,,,,,,,,,,,,,1,,,,,,,,,,,,,,,,,,,,,,,,,,,,,,,,,,1,,1,,,,,,,,,1,,,,,,,,,,,,,
Flyer advertising a donation drive to support African Freedom Fighters,,1,,,,,,,,,1,,,,,,1,1,,,1,,,,,,,,,1,,,,,,,,,,,1,,,,,,,,,,,,,,,,,,,,,,,,,,,,,,,,,,,,,,,,,,1,,,,,,,,,,,,,,,,,,,,,,,,,,,
Letter of invitation from the Committee to Free the SASO 9,,,,,,,,,,,1,,,,,,1,1,,,1,,,,,,,,,,,,,,,,,,,,1,,,,,,,,,,,,,,,,,,,,,,,,,,,,,,,,,,,,,,,1,1,,1,,,,,,,,,,,,,,,,,,,,,,,,,,,
Sign stating End Racist Terror! used at Million Man March 20th Anniversary,,,,1,,1,1,,1,1,1,,1,,,,,,,,,,,,,,,,,,,,,,,,,,,,,1,1,,,,,,,,,,,,,,,,,,,,,,,,,,,,,,,,,,,,,,,,,,,,,,,,,,,1,1,,,,,,,,,,,,,,,
Pamphlet for the 1977 March on the White House for African Liberation,,,,,,,,,,,1,,,,,,1,1,,,1,,,,,,,,,,,,,,,,,,,,1,,,,,,,,,,,,,,,,,,,,,,,,,,,,,,,,,,,,,,,,,,,,,,,,,,,,,,,,,,,,,,,,,,,,,
Pan African flags used at the Million Man March 20th Anniversary,,1,,,,,1,,1,1,1,,,,,,,,,,,,,,,,,,,,,,,,,,,,,,1,,,,,,,,,,,,,,,,,,,,,,,,,,,,,,,,,,,,,,,,,,,,,,,,,,,,,,,,,,,,,,,,,,,,,
